容器开发高级工程师,15-30K,岗位职责：1、负责基于Kubernetes容器服务的架构设计、开发等工作；2、参与其他开源容器产品和国内外相关前沿技术预研；3、牵引服务团队的技术方向和服务的竞争力构建。岗位要求：1、熟练掌握Go语言开发，具备Java、C、Python等其他一种或多种语言开发经验；2、熟悉Kubernetes、Docker等容器生态软件技术原理，具有丰富的面向容器的集群资源调度平台使用经验。3、熟悉Docker/Kubernetes生态开源项目代码，有社区贡献者优先；4、具备良好的沟通以及协调能力，能胜任跨团队跨部门协作。,华为在IP领域有着超过20年的专业积累，我们致力于打造差异化的创新产品，持续将5G、云、AI等数字技术创新运用于IP技术中，构建无处不在的极致联接体验，助力用户加速迈入万物互联的智能世界。市场份额持续领先：我们在全球150个国家拥有数万家渠道和合作伙伴，拥有500亿市场空间，5年内净增百亿，实现,东莞市 东莞市 溪流背坡村(华为)
自动化测试,12-20K,岗位职责：1、负责特性自动化脚本开发、音频检测算法开发、工具开发等工作。2、按时完成开发工作，同时参与测试用例的设计与优化。任职要求：1. 计算机、软件工程、自动化、数学等相关专业本科及以上学历；2. 2年以上软件开发及测试经验，有蓝牙耳机、蓝牙音箱等产品或者APP自动化开发经验者优先；3. 具备C/C++/python任意一个主流语言的开发基础；4. 具备较强责任心和团队精神，承压能力强，工作积极主动,"中软国际有限公司（以下简称：中软国际）是中国领先的大型综合性软件与信息服务企业，成立于2000年，为香港主板上市公司，股票代码00354，员工约62,000人。面对当今互联网化，以及云计算、大数据的挑战，中软国际建立了线下与线上互动的业务结构（O2O）。线下业务依托中软国际多年积累起来的传统",东莞市 东莞市 华为松山湖工业园
JAVA开发工程师,15-30K·14薪,"【岗位职责】：负责机器学习、运筹优化算法、大数据挖掘、深度学习等算法开发与改进【岗位要求】1、3年以上编码经验，掌握C/C++、 Java/Scala, Python中的至少一种,掌握常见的数据结构、软件算法，熟练常用设计模式。2、有代码性能优化、代码模块重构的经验者优化。3、有机器学习，或大数据处理，或并行计算，或启发式优化等算法开发经验者优先。【部门介绍】我们在国内和海外均部署有核心团队，国内主要分布于深圳/东莞、上海、西安等城市。我们当前的业务和未来定位 面向服务数字化业务与平台，布局核心算法的技术研究与突破； 面向服务数字化业务与平台交付核心算法能力、组件，实现技术竞争力的业界领先。 服务数字化业务领域新技术的研究与突破，构建差异化竞争力；我们的目标：致力于构建“精英+精兵+平台+知识+伙伴”于一体的综合解决方案，实现网络性能最优、运维效率最高、客户体验最佳。 我们的愿景：成为华为数字化的驱动者、引导者，基于数字化云平台，使能运营商及政企客户智能化转型，支撑电信产业向网络自动驾驶、数字化、自动化、智能化的方向发展。",消费者BG/软件部,东莞市 东莞市 溪流背坡村(华为)
通用软件开发工程师,20-30K,工作地点：东莞松山湖职位描述：承担公有云、私有云、SDN/NFV、IOT等运营、运维系统中相关模块的设计、分析，以及代码开发、具体技术方案的实现，同时完成AT/UT等测试，能够与团队融洽协作，高质量完成系统交付。1、熟悉DevOps和服务化的开发模式，或有参与过大型网站的设计和开发；2、承担公有云、私有云、SDN/NFV、IOT等运营、运维系统中Web服务前端服务的分析、设计、开发工作；3、能够独立完成Web服务的上线、性能优化和维护工作。要求：1、全日制本科以上学历，有良好的英语听说读写能力，软件工程/计算机/电子/通信等相关专业毕业；2、精通至少一种（Java、JS、C++、Python、Go等）开发语言；熟练使用至少一种数据库（SqlServer、Oracle、Mysql、DB2等），精通SQL和常见优化；3、熟悉JavaScript/CSS/HTML/Angular/React/Node.js，熟悉web安全、响应式设计，熟练使用Redis、mysql；薪资：12k-30k/本科及以上/全职/经验3-5,华为在IP领域有着超过20年的专业积累，我们致力于打造差异化的创新产品，持续将5G、云、AI等数字技术创新运用于IP技术中，构建无处不在的极致联接体验，助力用户加速迈入万物互联的智能世界。市场份额持续领先：我们在全球150个国家拥有数万家渠道和合作伙伴，拥有500亿市场空间，5年内净增百亿，实现,东莞东莞市溪流背坡村(华为)
硬件测试工程师,12-20K,1、懂layout2.有做交换机，路由器，光猫，OLT，机顶盒，车载网关相关经验的优先，熟悉测试，懂Python可以。,"中软国际有限公司（以下简称：中软国际）是中国领先的大型综合性软件与信息服务企业，成立于2000年，为香港主板上市公司，股票代码00354，员工约62,000人。面对当今互联网化，以及云计算、大数据的挑战，中软国际建立了线下与线上互动的业务结构（O2O）。线下业务依托中软国际多年积累起来的传统",东莞东莞市光大We谷A区A1栋5楼
Java,15-30K·14薪,1. 负责智能运维算法  2. 通过机器学习或统计算法提升运维效率  3.精通java或python  4.有运维经验优先      工作地：西安/南京/东莞/上海等地,消费者BG/软件部,东莞东莞市华为溪流背坡村K3栋
数据挖掘高级工程师,20-40K,岗位职责：1、  分析业务目标达成需要的数据支撑，并搭建数据模型和架构；2、 完成数据定义、数据逻辑、数据血缘关系的设计；3、 完成算法和模型设计；4、 通过集成好的数据，进行数据清洗、关联、建模和模型呈现；5、能够将通过数据分析和建模的数据结果，指导业务的使用，促进业务改进；岗位要求：业务技能要求：1、 独立成功交付过数据挖掘、建模类项目，或者承担过专题数据建模的数据架构、算法设计等，具有成功案例；2、能够独立领导完成数据处理工作，用常用数理统计/算法模型（含机器学习、深度学习等)解决复杂业务问题，改进优化模型算法，主导探索性分析；3、 理解客户商业目标、商业指标在方案中如何落地，指导与推进分析结果落地，能够明确呈现出方案对客户的价值；4、 客户需求理解和沟通能力较强，协调能力强，具备一定的谈判能力；专业知识要求：1、具备基础的通信行业知识背景或熟悉数据分析类项目交付特点和关键管控点2、熟悉并可以独立数据分析和建模关联。3、有丰富的通信或数据分析行业工作经验（5年以上），熟悉数据库，数据架构，数据挖掘算法及原理，机器学习算法，精通SQL、SPSS/R/python/SAS等数据分析工具中的至少2种；4、具备较丰富的数据挖掘与分析工作经验；具备一定的电信行业知识，熟悉运营商流程架构和CRM、Billing、BI等系统能适应全球出差、外派，有海外项目交付经验。,华为在IP领域有着超过20年的专业积累，我们致力于打造差异化的创新产品，持续将5G、云、AI等数字技术创新运用于IP技术中，构建无处不在的极致联接体验，助力用户加速迈入万物互联的智能世界。市场份额持续领先：我们在全球150个国家拥有数万家渠道和合作伙伴，拥有500亿市场空间，5年内净增百亿，实现,东莞市 东莞市 华为技术有限公司 松山湖高新技术产业开发区环湖路9号
测试开发人员,13-26K,业务技能要求：（985&211）1、 2年以上测试开发工作经验；2、 具备软件测试经验基础能力，能够独立承担项目测试设计与执行工作；3、 掌握主流的自动化测试技术，具备自动化设计、开发实战经验；4、 对微服务架构，服务化测试方法有一定的理解和实战经验，有互联网产品测试经验优先；5、 具备良好的沟通协调能力和团队合作精神、良好的学习、动手以及解决问题的能力。专业知识要求：1、 计算机、通信、软件工程、网络等相关专业，熟悉TCP/IP网络；2、 熟悉基本的测试方法和理论，白盒测试、黑盒测试等常用技能；3、 掌握java、python等脚本语言，能作为工作语言进行自动化脚本写作及测试工具开发；,"中软国际有限公司（以下简称：中软国际）是中国领先的大型综合性软件与信息服务企业，成立于2000年，为香港主板上市公司，股票代码00354，员工约62,000人。面对当今互联网化，以及云计算、大数据的挑战，中软国际建立了线下与线上互动的业务结构（O2O）。线下业务依托中软国际多年积累起来的传统",东莞市 东莞市 华为松山湖工业园
后台工程师&高级工程师&算法工程师,15-30K·14薪,负责华为数通内外研发计算云业务开发，设计等工作1.要求熟练掌握java/python/c++/C；2.掌握常见的数据结构、算法，了解软件工程、敏捷开发等知识，熟悉常用设计模式3.熟练掌握人工智能、动态规划、计算几何、模式和图像识别、可视化建模相关算法，有相关经验者优先；4.具备良好的计算机、软件工程、通信等专业领域知识；5.华为&德科联合招聘，挂职外企德科，同德科签署劳动合同，在华为研究所办公，参与华为核心项目研发，待遇与华为岗位同等，五险一金均按照实际薪资缴纳，按绩效情况，1~4月的年终奖；工作地点：东莞、南京、武汉,消费者BG/软件部,东莞市 东莞市 溪流背坡村(华为) 中国(China)-东莞(Dongguan)-松山湖高新技术产业开发区环湖路9号
软件开发工程师（OD岗位）,15-30K,岗位职责：1、负责云平台Web前端、后端技术框架与核心组件的设计和开发；2、理解云平台用户体验行为，完成前端用户体验UI的设计和开发3、负责模块、服务开发，安全特性开发；任职要求：1、熟练掌握html/css/javascript/es6，Vue ，ElementUI等前端框架和相关技术，熟悉http/https协议者优先；2、精通Java、Python、GO、C等一种或多种编程语言，具备良好的算法和编程能力；3、在 Web安全、性能优化、可用性、易用性等领域有一定的经验；,华为在IP领域有着超过20年的专业积累，我们致力于打造差异化的创新产品，持续将5G、云、AI等数字技术创新运用于IP技术中，构建无处不在的极致联接体验，助力用户加速迈入万物互联的智能世界。市场份额持续领先：我们在全球150个国家拥有数万家渠道和合作伙伴，拥有500亿市场空间，5年内净增百亿，实现,东莞市 东莞市 溪流背坡村(华为)
装备测试,12-24K,业务技能要求：1、熟悉linux操作系统，了解常用的操作命令2、有一定的装备、硬件测试经验4、具备良好的沟通、协调能力，有很强的责任心和求知欲，敢于突破和挑战。以下知识能力具备一项或多项者优先：1、有装备测试经验和华为测试经验者优先2、熟悉掌握但不限于C/C++/Java/python/shell等编程语言的一种或多种，有自动化开发经验者优先；,"中软国际有限公司（以下简称：中软国际）是中国领先的大型综合性软件与信息服务企业，成立于2000年，为香港主板上市公司，股票代码00354，员工约62,000人。面对当今互联网化，以及云计算、大数据的挑战，中软国际建立了线下与线上互动的业务结构（O2O）。线下业务依托中软国际多年积累起来的传统",东莞市 东莞市 华为松山湖工业园
5G工具开发,18-30K,"岗位职责：1.负责PIN维护工具项目开发，涵盖需求收集，需求分析，软件设计，编码实现，自验证等全流程；2.负责PIN工具的维护，解决内外部对工具提出的问题；3.持续优化工具结构，提升工具开发效率及工具易用性；岗位要求：1.熟练掌握JAVA,Python，SQL等开发语言，有嵌入式产品开发测试经验2.本科及以上学历，通信相关专业毕业；3.有WEB项目开发经验；4.良好的沟通表达能力",消费者BG/软件部,东莞市 东莞市 华为溪流背坡村H8栋
软件开发工程师,25-50K,"【工作职责】""有软件开发和设计经验；可以独立完成模块/组件的软件需求分析、软件设计、代码编写、单元测试、静态检查、本地构建等工作；与周边干系人沟通协作，对齐业务目标并按计划顺利完成任务。1、负责网络/无线网络协议设计开发、用户现网问题分析定位；2、负责新协议分析、设计、特性开发与维护；""【任职要求】""业务技能要求：1、熟练掌握Java、C、C++、python、JA等主流开发语言的一种；2、有C或C++或Python软件开发调试经验，能够分析解决软件类问题；3、熟悉TCP/IP协议、HTTP协议，具备分析抓包的能力、Linux配置和Shell使用；4、了解常用的软件架构模式、基本的编程编译工具。专业知识要求：1、熟悉JAVA、C、C++、python、JS中的至少一种，掌握常见的数据结构、算法，了解软件工程、敏捷开发等知识；2、信息系统/计算机/通信等相关专业，精通嵌入式软件或微码编程，本科及以上学历，英语通过四级及以上； 3、通信业务背景，熟悉ISO/OSI框架中2~3层相关协议及应用；4、对技术有激情，喜欢钻研，能快速接受和掌握新技术，有较强的独立、主动的学习能力。5、有网络仪器仪表、网络协议、通信协议等领域相关开发经验者优先。""",华为在IP领域有着超过20年的专业积累，我们致力于打造差异化的创新产品，持续将5G、云、AI等数字技术创新运用于IP技术中，构建无处不在的极致联接体验，助力用户加速迈入万物互联的智能世界。市场份额持续领先：我们在全球150个国家拥有数万家渠道和合作伙伴，拥有500亿市场空间，5年内净增百亿，实现,东莞市 东莞市 华为溪流背坡村B区
测试工程师,13-26K,岗位职责：1、负责特性自动化脚本开发、音频检测算法开发、工具开发等工作。2、按时完成开发工作，同时参与测试用例的设计与优化。任职要求：1. 计算机、软件工程、自动化、数学等相关专业本科及以上学历；2. 2年以上软件开发及测试经验，有蓝牙耳机、蓝牙音箱等产品或者APP自动化开发经验者优先；3. 具备C/C++/python任意一个主流语言的开发基础；4. 具备较强责任心和团队精神，承压能力强，工作积极主动,"中软国际有限公司（以下简称：中软国际）是中国领先的大型综合性软件与信息服务企业，成立于2000年，为香港主板上市公司，股票代码00354，员工约62,000人。面对当今互联网化，以及云计算、大数据的挑战，中软国际建立了线下与线上互动的业务结构（O2O）。线下业务依托中软国际多年积累起来的传统",东莞市 东莞市 溪流背坡村(华为)
软件开发工程师,13-20K·13薪,1-4个月,"1）熟悉java、python、JS、Go等编程语言能力,熟练掌握java1.8和python3.7版本新特性。2）熟练掌握mysql/redis数据库使用，熟悉linux操作系统及shell编程；3）熟悉微服务开发模式，具有良好的编码规范意识。业务知识1、具备1-3年以上产品软件开发经验。2、熟悉Spring、MVC、mybits等开发框架，具备web产品和服务化开发能力。3、熟悉网络安全、计算机基本算法、网络通讯协议等相关计算机知识。",东莞市 东莞市 华为公司 松山湖溪流背坡村
中间件开发工程师【华为OD】,13-26K,岗位职责：1、负责云中间件服务架构的设计和核心代码开发工作；2、负责nginx/kafka/redis/zookeeper/RabbitMQ等开源中间件关键技术的研究和竞争力构建。3、参与中间件产品和国内外相关前沿技术预研；岗位要求：1、至少精通Java、C、Go、python任意一门语言，具备良好的算法和编程能力；2、熟悉springboot/nginx/kafka/redis/zookeeper/RabbitMQ等开源中间件技术及源码者优先；3、有云服务化开发经验，DevOps实践经验，开源社区项目代码贡献者优先。,华为在IP领域有着超过20年的专业积累，我们致力于打造差异化的创新产品，持续将5G、云、AI等数字技术创新运用于IP技术中，构建无处不在的极致联接体验，助力用户加速迈入万物互联的智能世界。市场份额持续领先：我们在全球150个国家拥有数万家渠道和合作伙伴，拥有500亿市场空间，5年内净增百亿，实现,东莞市 东莞市 溪流背坡村(华为)
C、C++,12-24K,【岗位职责】参与智能协作领域的音频、视频、AI及人机交互等创新技术的预研设计，原型开发及技术验证。1、音频：降噪、去混响、远场拾音等AI MIC处理；2、视频：图像增强、图像识别、视频编解码优化等AI视频增强技术；3、会议AI：语音会控、声纹识别、会议摘要等智能语音技术。【岗位要求】1、信号处理或者电子、通信、计算机等相关专业；2、熟悉C或C++；3、熟悉linux操作系统，并能够在其上进行C/C++开发；4、工作有责任心、做事细心，服从安排，能够保证工作内容交付质量；5、技术开发需独立探索，要主动思考的能力，不仅仅是按照要求开发；6、熟悉语音信号处理，视频信号处理，智能语音、智能视频、AI、机器学习（python/matlab）或者神经网络、ARM平台优秀化者优先；7、涉及端侧设备的demo集成开发。,"中软国际有限公司（以下简称：中软国际）是中国领先的大型综合性软件与信息服务企业，成立于2000年，为香港主板上市公司，股票代码00354，员工约62,000人。面对当今互联网化，以及云计算、大数据的挑战，中软国际建立了线下与线上互动的业务结构（O2O）。线下业务依托中软国际多年积累起来的传统",东莞市 东莞市 华为松山湖工业园
大数据解决方案交付工程师,18-30K·14薪,岗位职责1、负责FusionInsight大数据平台解决方案设计；2、负责FusionInsight大数据平台产品的交付和性能比拼，指导客户通过大数据平台进行二次开发。岗位要求1、熟悉Linux的基本操作命令，熟悉Java/Python/Shell的一种或多种；2、有Hadoop/HBase/Spark/Hive等大数据组件或SQL数据库测试经验者优先；3、有Java编程基础、大数据应用的二次开发经验、熟悉大数据业务应用场景者优先。工作地点：东莞松山湖、西安,消费者BG/软件部,东莞市 东莞市 溪流背坡村(华为) 东莞松山湖或西安研究所
软件工程师,15-30K,【岗位职责】参与公司软件开发，承担模块设计【岗位要求】1、本科以上计算机相关专业，工作年限不限（非应届生）；2、熟悉JAVA/C++/Python/前端开发/android，具备扎实的软件基础，熟悉常用的设计模式、数据结构和算法。3、具备Spring、Vue等框架实践经验优先。【工作地点】东莞/西安/北京【招聘形式】华为OD：德科签约，岗位职级和薪资对标华为职级，定位为华为侧员工，内部有晋升华为自有的通道，详情可联系招聘人员了解。,华为在IP领域有着超过20年的专业积累，我们致力于打造差异化的创新产品，持续将5G、云、AI等数字技术创新运用于IP技术中，构建无处不在的极致联接体验，助力用户加速迈入万物互联的智能世界。市场份额持续领先：我们在全球150个国家拥有数万家渠道和合作伙伴，拥有500亿市场空间，5年内净增百亿，实现,东莞东莞市华为溪流背坡村L1栋3楼
JAVA开发,12-20K,"精通 (Java && SSH / SpringMVC&MyBatis),对框架源码级有研究者优先考虑；精通MySQL的使用，熟悉分布式数据库的设计与优化；有MongoDB、Redis、Memcached等缓存数据库开发经验；熟悉Linux操作系统，掌握该系统下常用命令和工具的使用，熟悉脚本语言（shell、perl、python）更佳；擅长Java性能调优，对大型分布式系统有较深入的研究，具备高并发高可用性系统开发经验者优先；","中软国际有限公司（以下简称：中软国际）是中国领先的大型综合性软件与信息服务企业，成立于2000年，为香港主板上市公司，股票代码00354，员工约62,000人。面对当今互联网化，以及云计算、大数据的挑战，中软国际建立了线下与线上互动的业务结构（O2O）。线下业务依托中软国际多年积累起来的传统",东莞市 东莞市 溪流背坡村(华为) D区
测试大数据开发工程师,13-25K,工作内容:1、通过对研发过程中产生的数据进行分析和AI模型训练，使研发过程智能化2、设计和构建核心AI基础架构组件，以简化AI和机器学习技术的使用，帮助构建和运营业务交付3、为大规模数据分析建立可扩展，高效，自动化的流程。技能要求:1、计算机科学或相关领域（专注于AI或机器学习）2、熟练应用的Python / JAVA / C编程技巧3、具有Spark，Tensorflow等分析工具的经验4、熟悉SQL数据库或类似经验,消费者BG/软件部,东莞市 东莞市 华为欧洲小镇
软件开发高级工程师,21-40K,1、深入理解并精通C/C++/Java/Python/Go等一种或多种语言的开发应用，具备大型软件产品设计和开发经验；2、5年及以上项目开发经验，独立承担过模块开发、架构设计工作；3、内心对技术有激情，喜欢钻研，能快速接受和掌握新技术，有较强的独立、主动的学习能力；4、参与软件技术竞争力构建，架构设计，技术规划，分析业界发展趋势，完成技术竞争力识别；（软件架构岗位）5、熟悉网络安全等相关领域，对安全攻防、渗透测试（如DDOS攻防）等相关项目经历（高级安全岗位）,华为在IP领域有着超过20年的专业积累，我们致力于打造差异化的创新产品，持续将5G、云、AI等数字技术创新运用于IP技术中，构建无处不在的极致联接体验，助力用户加速迈入万物互联的智能世界。市场份额持续领先：我们在全球150个国家拥有数万家渠道和合作伙伴，拥有500亿市场空间，5年内净增百亿，实现,东莞市 东莞市 松山湖 环湖路华为基地
大数据开发工程师,15-30K,岗位职责1、负责Hadoop/Spark/图数据库/流处理/搜索引擎/协同计算等产品设计和开发；2、负责Hadoop/Spark生态圈组件维护，开源社区动态跟踪、竞争力分析和规划技术演进。岗位要求：1、3年以上软件设计和开发经验，精通Java/Scala/Python/C/C++中的一种或多种，熟悉Linux/Unix操作系统原理；2、有分布式系统设计开发经验，能独立承担软件模块设计和开发工作；3、精通Hadoop、Spark、HBase、Hive、ElasticSearch、Flink等组件内核源码优先，Hadoop、Flink、HBase社区Committer、PMC优先。,消费者BG/软件部,东莞市 东莞市 溪流背坡村(华为)
