python后端,5-10K,"1.根据部门安排，从事功能设计与编码工作，保证项目按照时间和质量要求完成；2.根据工作安排，承担开发的工作；3. 系统部署后对内部客户(其他产品开发团队)提供应用维护方面的支持, 包括监视,升级, 定位问题,故障恢复等。任职要求：1.熟练掌握python基础知识，包括面向对象特征，常见API等;2.工作主动性强，耐心细致，有责任心；能承受一定压力，有良好的沟通能力与团队合作精神； 不能接受微信线上笔试的勿扰！！",公司主营业务为亚马逊平台的跨境电商企业年轻企业，产品已覆盖美国、英国及欧洲等站点。2018年销售额已突破千万人民币。同时公司已开发了两款款适用于跨境电商企业使用的数据服务工具。公司成员均为90后的年轻团队，创始人为英国牛津大学毕业的高材生。,广州番禺区广州大学城信息枢纽楼
Python工程师,9-14K,"一、职责1、负责搭建Python开发环境、开发工具和运行环境；2、负责Python程序的开发和测试；3、负责编制软件研发过程的各项文档；二、综合素质：1.	全日制本科及以上学历，计算机相关专业，2年以上开发经验，2个以上系统开发经验；2.	具有良好的团队协作精神、语言表达能力、学习总结能力；三、技术水平：1、	了解计算机网络、计算机、python的运行原理；2、	熟练使用Python、Shelll等脚本语言编写程序；3、	熟练搭建Python开发环境、安装Anaconda、TensorFlow2.0 Alpha等开发工具；4、	熟练使用Linux操作系统，oracle、mysql数据库，WebLogic、tomcat中间件；5、	了解使用IDEA、MyEclipse、PowerDesigner、Git开发工具；6、	了解练使用Spring MVC、Spring Cloud、Spring Boot、MyBatis等开源框架；7、	了解使用Java语言进行面向对象程序开发，具有良好的编程习惯；8、	了解HTML、JSP、JavaScript、CSS、JQuery、Json、AJAX等前端技术和VUE等前端框架；9、	了解移动APP和微信小程序的开发技术；",数智科技是一家新型互联网企业，总部设在广州市珠江新城，下设数智工控和数智城市两家子公司，现有员工150余人，研发人员近120人，专注云计算、大数据、人工智能、网络安全等领域的研发创新，是中国智慧城市运营联盟的重要发起机构。响应国家号召，助力“中国制造2025”、&ldquo,广州市 天河区 宏发大厦(天河南二路)
Python高级开发工程师(数据分析方向）,12-20K,职位描述：1、具有良好的沟通能力；2、能对产品需求进行分析，提供技术方案，并能单独完成需求；3、能及时发现需求中出现的问题，独立思考原因，并解决；4、有较强的抗压能力，承受多重的工作压力。专业素质要求：1、计算机等相关专业，本科及以上学历；2、熟练Python，熟练掌握numpy、pandas、sklearn等第三方库；3、熟悉数据采集与处理，掌握scrapy/request等采集方式，至少熟悉flask/django其中一种框架；4、熟练掌握多种统计和挖掘方法，了解推荐算法；5、较强的数据敏感度，逻辑分析能力和文档写作能力；6、有责任心，良好的沟通能力和组织管理能力以及心理承受能力，勇于接受挑战。,"名医汇(www.mingyihui.net)，创立于2012年,隶属于广州诚益信息科技有限公司，高新技术企业。 从创立之初，名医汇即聚焦于帮助病患解决就医过程中治疗信息泛滥而真正有用的信息缺失、就医渠道不足导致急需高水平医生治疗的病人无法得到救治的难题。经过两年的发展，名医汇已成为该领域覆盖面最",广州市 越秀区 汇华商贸大厦 1803-1805
高级python工程师,20-30K,5年+ 实际爬虫经验 / 全职职位诱惑技术驱动型公司 | AI 产品开发 | 技术挑战 | 成长空间大 | 内容营销风口 | 周末双休公司介绍头文科技 —— 一站式企业内容营销平台我们已经打通了内容营销的全产业链，从品牌诊断、策略制定到内容生产和内容分发。我们是一家以技术为驱动的公司，通过技术手段提升内容生产及分发的效率，提高内容生产质量。公司成立 1 年多以来已经形成了十分健康的现金流，通过技术加持，公司利润不断攀升。公司网站：www.topwin.tech职位描述工作内容：根据公司发展需求，制定数据收集、鉴别、聚合、应用策略爬虫系统的架构设计与开发，构建抓取服务平台设计算法，制定防屏蔽规则，提升网页抓取的效率和质量，能够快速且有效的进行数据清洗与文本挖掘职位要求：本科及以上学历，计算机相关专业毕业熟悉Java、 C++、 Python 等其中至少一种语言熟悉大规模网页爬取，深度网页爬取，至少熟悉以下一种框架Nutch、Scrapy、Lucene、Heritrix、Solr、Sphinx等对主流爬虫架构有深入研究，具有成熟爬虫工具的设计及运维经验有海量数据处理的丰富经验，有大数据处理加工及大数据公司工作经验者优先！,头文科技是一家以技术驱动，整合大数据提供内容传播和营销服务的平台。公司自主研发了“头文指数”、“写作助手”等产品，辅助自媒体人提升内容创作和分发效率，让人人都能够创作出“10万+”爆款文；并通过自主搭建的头文工业化内,广州番禺区诺德中心2407
Python web开发工程师,15-25K,1、负责开发游戏互动产品运营、运维平台；2、开发 Web API；3、开发公司内部网站平台。职位要求：1、计算机本科相关专业，4年以上python web开发经验（有 C/C++ 经验加分）；2、对 Web 后端技术架构有基本的理解；熟练使用 mysql，mongodb；熟悉tornada，django框架3、对 Web 后端技术架构有基本的理解；具备良好的学习能力，富于团队精神。,,广州市 天河区 黄埔大道
Python 后端开发工程师,15-25K·15薪,"任职要求：1.熟悉计算机基础,如网络,操作系统,软件工程以及数据结构算法等计算机知识2.熟练掌握 python 语言和java语言，可实现面向对象开发；3.熟练掌握 django 以及django Restframework开发；4.熟练掌握 MySQL，能独立完成库表/索引等设计与优化；5.熟悉互联网中间件redis，rabbitmq，celery等，能独立部署开发与问题排定位排查；6.熟悉uwsgi，nginx等部署以及限流，负载, 熔断等操作，有过高并发高可用设计优先；8.熟悉管理工具git(硬性要求)/jenkins, 并能独立开发完成单元测试的编写；9.熟悉并有开发 restful API 的经验；10.熟悉 linux 常用命令，能快速定位排查线上紧急问题；11.熟悉网络/底层IO/并发编程优先考虑;12.全日制本科以上学历,211/985院校计算机专业优先考虑",广州咿咿呀呀网络科技有限公司（以下简称咿咿呀呀），于2018年11月31日注册成立，是全国性的直播和社交业务服务商。旗下业务主打音频直播、社交等领域，当前核心产品甜泡泡正处于开发阶段，甜泡泡是一款语音社交APP，旨在提供基于媒体语音等行业技术水平的优质交友体验。咿咿呀呀以技术，产品为核心，以用户,广州市 天河区 天辉商业大厦 2楼2h09
python工程师,11-20K,python工程师招聘要求：1. 精通利用python进行网络编程，熟练使用多进程和多线程。2. 熟悉Oracle数据库，精通者优先3. 精通Linux内核结构，并熟练使用各种linux操作系统命令。4. 熟练使用db2、informix、mysql、postgresql5. 具备良好的编程习惯（有编写单元测试习惯），并熟悉开发测试一体化基本流程，熟练使用git、reviewboard、bugzilla等常用质量管理工具6. 具备良好的沟通能力，能够将问题描述清楚，并主动与团队沟通7. 能过承担编程压力和学习压力，具备正面思维者优先待遇：工资(>15k)+奖金+期权（奖金直接和年销售额挂钩，以月工资基数为准乘以销售额系数，预计销售额达到5000万人民币，即可获得额外相当于8个月工资的奖金）,D-Uni 公司（中文：颉一软件）由硅谷归国专家团队创建，持续 15 年的企业数据管理和云化领域的技术沉淀、首创性的提出了“数据库虚拟化”、“数据虚拟化”、“数据管理敏捷层”等创新性理念，定义和开创了新的产品品类，全面领先业界,广州天河区科汇园
高级Python工程师,17-21K,岗位描述:1、总体技术框架的规划与设计，重构、优化现有的技术架构。2、负责微服务应用开发框架研究、开发、重构工作。3、把握系统总体架构，解决系统中关键问题和技术难题。4、分析系统瓶颈，处理、协调和解决基础框架中出现的技术问题；5、负责系统框架，核心模块开发实现。6、负责公司核心技术问题的攻关和人才培养要求如下:     1、精通Python、Java 2、熟悉常见Python web架构，精通Django、Tornado者优先； 3、具备数据库设计能力，熟练掌握MySql/MongoDB/Redis者优先； 4、熟悉Linux操作系统，熟悉Nginx、uWSGI，能独立搭建高可用生产环境； 5、有大型网络服务开发经验，在高并发，高稳定性方面有经验者优先； 6、具备良好的编码习惯及开发文档书写习惯； 7、具有优秀的团队合作和沟通协作能力，善于学习，乐于分享； 8、了解或熟悉HTML、CSS、Javascript等前端技术优先。,"公司介绍：     广州拼吧信息科技有限公司，成立于2016年1月,位于广州市天河区翰景路1号金星大厦5楼F-12。我们致力于打造一家最优秀的互联网技术公司，简单、专业、高效是我们的追求。公司架构简单，扁平管理，你的领域你做主。团队关系融洽，没有繁文缛节的制度，也吃不到钩心“豆角&r",广州市 天河区 金星大厦 5楼 12-F
后端开发工程师 - python方向,15-30K,岗位职责：1、独立完成后台服务功能模块的设计与开发；2、配合团队其他成员进行模块开发及整合；3、维护所负责的服务模块，并不断持续优化功能系统；4、确保所负责的服务模块能够达到产品要求的质量标准（响应、错误率、不间断服务指标）。任职要求： 1、计算机相关专业，有2年以上实际工作经验2年，大专以上学历； 2、熟练使用Python，有良好的编码习惯，熟悉Django Flask Tornado开发框架; 3、熟练使用python常用的爬虫框架 Scrapy  cola; 4、深度熟悉 MongoDB\Redis\MySQL\PostgreSQL等数据库架构，并有良好的数据库设计和优化能力，能检查数据入库环节 5、熟悉Linux操作系统，熟练使用常用命令; 6、至少熟悉一种常用数据库：Mysql  MongDB Redis; 7、熟练使用Git，SVN等工具进行日常工作； 8、熟悉restful，oauth等框架或者技术 9、熟悉elasticsearch,优视TVCBOOK创立于2015年，是专为品牌主、代理公司、创作人提供的视频创作及分发工具，为全球50多个国家和地区的企业／创作者和广告机构提供服务。,广州市 越秀区 环市东 团结路26号
Python后台研发工程师,15-20K,1，使用python进行后台开发。2，提供数据挖掘算法和实现,,广州天河区广电平云广场
python架构师,20-30K,python架构师职位描述：1.负责公司云服务的核心代码开发和架构搭建，负责服务器性能优化2.设计和构建后端相关基础设施，优化开发、部署、运维等流程3.持续改进服务端架构和技术栈，提高系统稳定性和高可用性职位要求1.本科或以上学历，三年以上的python开发经验2.熟悉掌握Flask/Django/Celery等框架，阅读过部分源码，有较丰富的项目经验3.熟悉操作系统原理，熟悉多线程/多进程的并发管理，掌握服务器性能监控和调优4.具备较强的编码设计能力和架构能力，有开源项目者更佳5.具有较好的数据处理、数据优化能力，有云计算、分布式架构或计算密集型任务的处理经验6.拥有一定的持续测试、集成、部署实践经验7.加分项：有文件数据处理转换经验者优先，有3D模型处理经验者更佳,引力波是一家专注3D视觉及AI图形技术研发，以3D可视化数据为基础，融合AR/VR、云计算、AI/ML技术的高科技公司。公司拥有3D/XR类知识产权（专利&软著）10余项，已成为西门子物联网、百度云、阿里云等平台的XR应用生态合作伙伴。公司核心产品Realibox Studio为企业,广州番禺区五洲城国际建材中心C7002-C7006
Python,13-26K,"岗位职责：1、与产品经理、架构师、前端工程师等紧密合作，共同交付功能完善、稳定可靠的SaaS产品；2、参与后台系统代码设计与开发,使用敏捷产品开发流程来确保功能按时交付；3、编写、审查和维护技术文档；4、研究和评估新技术和框架,持续改善和提高产品的性能、灵活性及稳定性。任职资格：1、计算机相关专业，本科及以上学历，3年以上后台开发工作经验；2、精通C/C++，Java，Python等后台开发语言的一种或多种；3、精通MySQL，MongoDB，Redis等数据库；4、熟悉Apache，Nginx，Tomcat；5、熟悉Flask，Django等后台开发框架；6、精通面向对象的分析与设计，精通设计模式；7、有激情，有创造力，喜欢研究新技术，沟通能力良好。",探迹科技(TUNGEE)是专业的智能销售服务提供商，致力于用大数据和人工智能（AI）技术帮助企业全面提升销售效率。探迹科技成立于2016年，通过不断挖掘和分析全网信息，探迹已构建出覆盖全网超一亿家企业的全量知识图谱，并在此基础上结合NLP、机器学习算法等人工智能技术，为To B企业提供从线索挖掘、,广州番禺区广州探迹科技有限公司5楼
Python客户端高级开发工程师,10-20K,岗位要求：1，精通python开发，两年以上相关工作经验；2，精通脚本层接口抽象、设计；3，熟练掌握常用数据结构及算法；4，具备良好的编程习惯，对设计模式有一定了解；5，热爱游戏，能适应高强度的开发与工作压力； 工作职责：1，游戏客户端脚本层设计与开发；2，游戏客户端持续优化；,网易 (NASDAQ: NTES)是中国领先的互联网技术公司，在开发互联网应用、服务及其它技术方面，始终保持国内业界的领先地位。网易对中国互联网的发展具有强烈的使命感，网易利用最先进的互联网技术，加强人与人之间信息的交流和共享，实现“网聚人的力量”。,珠江新城侨鑫国际大厦
Python,10-15K,Python工作内容1、主要负责工具，脚本开发2、兼顾版本测试任务技能要求：1、python基础扎实。有好的学习能力就行,"中软国际有限公司（以下简称：中软国际）是中国领先的大型综合性软件与信息服务企业，成立于2000年，为香港主板上市公司，股票代码00354，员工约62,000人。面对当今互联网化，以及云计算、大数据的挑战，中软国际建立了线下与线上互动的业务结构（O2O）。线下业务依托中软国际多年积累起来的传统",东莞市 东莞市 华为松山湖工业园
Python中级开发工程师,12-20K,"Python中级开发工程师（计划2名，其中1名后期转算法）：（1）5年及以上服务端开发经验，精通python全栈开发，熟悉c++优先 ；（2）熟悉 Linux，熟悉 Mysql / Redis 等数据库开发；（3）熟悉Django或Flask的使用，并理解其设计原理；（4）对后端服务架构有较深刻的理解，能够根据实际场景合理应用常用的分布式及高并发开发所用到都相关技术 ；（5）熟悉常用科技计算库的使用(Numpy,Pandas等)；（6）了解深度学习，了解tensorflow/mxnet/pytortch框架使用",广州君思网络科技有限公司（以下简称君思网络）成立于2015年，是一家提供智慧园区规划，信息化落地，业务运营一体的综合性园区整体解决方案，同时集软件研发与销售、互联网业务、驻地开发管理于一体的综合性公司。总部位于广州市花都区中国新一代智能科技产业园(2025PARK)，在东莞、上海、长沙、番禺设有分支,广州越秀区时代地产控股有限公司
python后端开发,13-25K,--【python开发工程师（初中级）】--薪资范围：10k-15k岗位职责：1、负责公司业务系统的后端开发；2、跟进产品需求参与需求分析，进行相关的设计、开发、调试、测试等；3、能独立完成业务模块的开发。任职要求 ：      1、1-3年python后端开发经验，掌握flask等web开发框架；2、熟悉网络编程（TCP/HTTP协议），并具备MQ(kafka等)、高并发实战经验；3、了解git flow开发流程，熟悉CI/CD部署；4、熟悉MySQL数据库，具备MySQL、mongodb、redis等开发和调优经验；5、掌握Linux系统，会shell编程；6、良好的编码风格，至少熟悉其它一种语言(C++、Java、go)。--【python开发工程师（高级）】--薪资范围：15k-25k岗位职责：1、参与相关业务线的后端研发工作；2、负责业务需求分析，将业务需求拆分成独立的业务功能，设计技术方案，输出相关文档，并负责相关的开发等工作；3、完善公共代码库，持续推进业界最佳实践在项目中的应用；4、配合项目的整体计划和安排，对业务人员进行技术指导；任职要求：1、4年及以上服务端开发经验，熟练掌握python，另外熟悉c++/go优先2、具备扎实的计算机基础知识，有良好的代码风格，熟练掌握常用的设计模式和数据结构3、熟悉 Linux，熟悉 Mysql / Redis 等存储系统，熟悉相关调试工具，能够快速定位解决问题4、对 Web 服务架构有较深刻的理解，能够根据实际场景合理应用常用的分布式技术5、有良好的沟通协调能力和团队合作精神6、善于管理优先级，能够运用常用的软件工程方法管理开发流程，了解 CI / CD。,公司概况：广州回头车信息科技有限公司，简称省省回头车，于2014年在广州创立，是一家立足于货运行业的互联网科技公司。公司推出的省省智能物流平台，以APP、小程序等工具连接需求方和承运方，用”省时、省心、省钱的方式“满足中小企业和个人的”送货、搬家、发物流&ldq,广州市 天河区 时代TIT广场B区 2栋7楼701
Python中级开发工程师,13-25K,1.配合架构师完成后台开发工作2.配合前端开发人员完成对接工作3.精通python，精通Django等框架4.精通数据结构及算法5.需要有独立开发项目经验，需要有个人博客6.熟悉服务器操作、Linux操作和数据库7.需要对框架有深层次理解，了解底层结构8.人好，性格好优先！这是重要指标！我们需要你和我们玩的到一起去！也希望你可以持续学习！,一家工程师文化的初创企业，主营在线教育：英语、口语、编程等。,广州天河区珠村(地铁站)金碧世纪花园
Python后端开发工程师,15-22K,我们是一个从微信出来的创业团队。想要做一款不会社交关系爆炸，永远不会不敢表达的社交产品。天使轮融资已经到位，希望找到志同道合的小伙伴加入我们。-----岗位描述：1. 负责后台服务架构设计和开发； 2. 参与设计系统技术方案，核心代码开发和系统调优； 3. 参与各专项技术调研，新技术引入等前瞻项目。岗位要求：1. 2年或以上后台开发经验，本科及以上学历，计算机相关专业； 2. 热爱计算机科学和互联网技术，精通Python语言，熟悉Golang； 3. 有优秀的逻辑分析能力，能够对业务逻辑进行合理的抽象和拆分；4. 有强烈的求知欲，优秀的学习和沟通能力；,我们是一群来自微信的小伙伴，专注在社交领域打磨产品。关注我们的公众号可以深入了解我们。,广州海珠区广州国际采购中心
高级python工程师,13-20K,"【岗位职责】1、负责数据抓取平台规划和建设，完成数据采集与爬取、解析处理和入库；2、研究各种网页探寻特点和规律，负责网页信息抽取、数据清洗工作；3、负责领域知识的定向爬取、深度提取和挖掘；4、配合数据清洗、整理、去重和合并工作；5、负责爬虫相关技术的创新和优化，爬虫系统建设。6、熟悉各种数据库操作。7、带领初级工程师完成工作。8、有android逆向经验，或有过java开发经验者优先。【任职要求】1、计算机相关专业，本科以上学历，3年以上爬虫领域工作经验，1年以上爬虫团队合作经验。2、熟悉Python开发，熟悉web开发，熟悉数据库（MySql,Oracle,Mongodb等），熟悉抓取框架，有完整的界面化爬虫平台开发经验；3、熟悉Web抓取原理及技术实现细节，对HTTP协议和HTML有深入了解；4、熟悉数据抓取和整合技术，从结构化和非结构化数据中提取信息；5、熟悉反爬机制，能够通过逆向js脚本，获取参数，熟悉使用正则表达式/验证码加密处理/代理池，熟悉行为验证码识别、模拟登陆。【公司福利】•5天7.5小时工作制，周末双休，弹性工作时间，不用担心迟到扣工资；•试用期内即购买五险一金；•传统节假日福利、生日礼品、结婚礼金、生育礼金、子女升（211大学）学礼金等；•午餐补贴、差旅补贴、通讯补贴；•年终奖金，年度调薪机会；   •带薪年休假与法定假期；•新兴而朝阳的行业，规模及产值行业领先、高速发展的企业平台；•内部设立博士商学院用于员工培训学习，学习空间广阔；•良好的职业发展通道、人才发展规划与完善的职业培训；•设立爱心基金，帮助困难员工跨越难关；•设立专项的团队建设活动经费，组织年度旅游，丰富员工活动，加强团队合作精神。",1、关于博士科技集团博士科技起源于2001年的广州博士俱乐部，历经19年发展，已成为我国技术交易生态体系的倡导者和实践者，国内顶尖的技术市场建设商、运营商和技术交易全链条服务商。 我们诞生在“土地是第一生产力”的劳动密集型时代，却在创建伊始就坚持以“把知识转化,广州黄埔区广东软件科学园
python（兼职讲师）开发,30-60K,1    每周直播并录制课程每周定期直播并录制视频，要求每周不能够少于两堂课，时间灵活。2    线上辅导保持实时qq或者微信在线，不定期回复同学的提问，问题是课内的内容，问题的响应时间不能够超过24小时。带领同学完成课程，必要时候需要远程帮同学操作一下，对于经常出现的问题，可以建立faq库，帮助同学快速解决问题。PZHUP person help person 欢迎加入我们，帮助哪些需要帮助的人,计算机信息科技领域内、电子科技领域内的技术开发、技术转让、技术推广、技术咨询、技术服务；计算机网络工程施工；教育信息咨询服务；非学历职业技能培训；计算机系统集成服务；计算机及辅助设备销售、维修；通信设备销售、安装、调试、维护；机械设备、电子产品销售。（依法须经批准的项目，经相关部门批准后方可开展经营,广州市 天河区 富力盈盛广场
Python,15-20K,1、有3年以上Python开发经验，熟悉Web后端架构       2、熟练掌握主流框架，如Django、Flask等至少一种能精通使用，并理解其设计原理       3、熟练图形图像文件数据分析、处理及提取，对工程类图像文件有经验者优先考虑,,广州市 黄埔区 光谱(南门) 广州市 黄埔区 光谱(南门) 科学城光谱路
Python工程师,15-30K,"岗位职责:1. 分析网站或WebView(APP内嵌网页)接口数据,找出接口所需的数据来源和生成途径；2. 编写接口文档,并开发相关接口调用DEMO ；要求(不需要全部掌握,根据情况加分)。任职要求:1. 35岁以内，统招大专学历，3年以上相关工作经验，熟练掌握常见Web数据交互(Form/JSON/Blob/Protobuf等)；2. 掌握HTTP/HTTPS/WebSocket抓包,懂CA证书校验并成功抓包的额外加分；3. 熟练使用JS,具备一定还原混淆过的JS的能力。额外加分项:1. 熟练使用常见算法并了解各种算法特性(AES/RSA/HASH等)；2. 深入了解过底层运行机制(例如JS引擎原理/浏览器加载时各个阶段做了什么)；3. 掌握任意一门略底层的语言(能大概看懂即可, 例如C/C++/Rust)。",,广州市 天河区 东泷创意园H栋
