Python,10-15K,岗位职责：1、  主要参与“短书“项目的服务端开发；2、  根据产品的需求提供符合项目或产品的解决方案；3、  参与平台日常开发，包括但不限于程序设计审查、代码审查等工作；4、  编写程序设计、API等相关技术文档。岗位要求：1、本科学历，2年Python相关工作经验，熟练使用Python语言;2、熟悉Linux常用命令或有Mac下的开发经验，能在常见Linux服务器（CentOS/Ubuntu）上简单排查问题；3、熟练使用MySQL/Postgres，了解NoSQL；4、熟悉Nginx/Apache等Web服务器的配置；5、有良好的需求分析、设计能力、规范的编程风格和良好文档习惯；6、至少精通一种Python框架（Django/Tornado）。加分项1、有写 Blog 的习惯，活跃技术社区，参与开源项目等；2、有代码洁癖，对代码精益求精，对技术有极客热情。,南京厚建软件有限责任公司是一家成立于2004年，注册资本1200万元的互联网公司，具备国家高新技术企业资质，连续多年被评为信用AAA级企业。公司致力于为全国媒体的融合和转型提供专业、全面的解决方案和服务，拥有近30项软件著作权。总部位于江苏南京，先后在北京、广州建立分公司，现有员工近300人。经过,广州番禺区洛浦街迎宾路五洲商务楼C座6006室
5G分布式软件开发工程师,15-22K·13薪,有效益工资，年终奖,华为联合外企德科招聘（华为OD模式）风起云涌的5G时代，最强电信云服务化/分布式数据库，业界独此一家，竞争力独领风骚，等你来战，共同铸就5G巅峰！【岗位职责】1、负责云化/服务化的分布式数据库系统的特性开发、问题定位和性能调优；2、主攻分布式云化数据库弹性、一致性及大规模并发读写高性能数据库等技术方向。3、参与产品云化/微服务化架构演进、微服务拆解，构建稳定、竞争力强的服务化架构并落地；面向未来承担关键软件技术的设计与开发。4、负责看护产品核心技术，承担模块关键技术、疑难问题攻关，提升产品优势。5、面向下一代网络架构，负责服务框架、网络切片和分布式磁盘引擎等前沿技术预研。【业务技能】1、计算机、通信、电子、自动化等相关专业全日制本科及以上学历；2、熟悉C/C++、Java、Python、Go、Js等语言的一种或多种，具备丰富开发能力和经验，能够熟练运用完成开发工作；3、具有良好的计算机和操作系统基础，熟悉常见的数据结构和算法，熟悉设计模式，具有一定的架构设计能力和重构经验；4、熟悉linux操作系统，对进程间通信/socket编程/多线程并发等有相关经验，有PaaS平台开发经验者优先；5、熟悉MangoDB/RocksDB等数据库者优先，具备数据库或高性能服务器软件设计开发经验者优先；6、熟悉Paxos/Raft等算法者优先；7、熟悉Tcp/IP/Sctp或者http，soap等协议者优先；5G的云化/服务化的分布式数据库，业界竞争力（含技术、市场份额）持续多年都是全球第一！有追求的技术咖们，现在就是最好的机会，加入我们吧！特别的，如果是熟悉python、shell的，有如下岗位需要大量人才：1、参与5G产品灰度升级/弹性伸缩/智能化改造/端到端系统部署集成等关键竞争力特性研发与交付2、参与5G产品各项研发敏捷流水线平台与工具研发/部署适配/集成，提升效率,东莞市 东莞市 华为欧洲小镇
Python开发工程师,15-28K,"1、3年及3年以上python项目开发经验；2、熟悉tornado,或flask、django框架，并深入了解其中一种；3、熟悉至少一种数据库（mysql、oracle）、至少掌握一种Nosql数据库（MongoDB、redis、HBase、Couchbase、Neo4j、Cassandra）；4、熟悉常用的web容器相关技术，熟悉uwsgi、nginx、web服务器；5、熟悉restful api设计风格和规则；6、良好的面向对象分析设计和编程能力，熟悉设计模式；7、熟悉云计算理论、CAP理论、微服务Python偏WEB开发的",武汉佰钧成技术有限责任公司（以下简称“佰钧成”）正式成立于2006年6月，成立至今已在全国20多个城市有分公司办事处，人员规模超过10000人，行业内排名第三。公司主要业务是面向欧美、日本以及国内市场的制造业、金融、电信、能源、IT及政府和公共服务行业提供 ITO、BPO服务,东莞华为南方工厂C区
JavaSE,15-30K,工作职责：1、负责Java项目的架构设计和系统分析工作，分阶段分别输出概要设计和详细设计；2、为Java项目开发团队，提供模块化，服务化的核心代码开发以及开发指导；3、负责部分技术预研，以及项目开发团队的技术能力赋能；岗位要求：1、计算机技术等相关专业本科以上学历，有深厚的Java功底及项目经验；2、5年以上 Java/J2EE 项目开发经验； 3、精通Java语言，熟悉Java及其服务化系统架构设计，有大型关系型数据库的开发和设计经验；  4、熟悉一种关系型数据库，熟悉SQL语言；熟悉NoSQL，有相关的项目经验更佳； 5、熟练掌握主流框架（Spring/Struts/MyBatis 或 SpringBoot/SpringCloud）的原理及使用者优先；6、有其他编程语言基础（如Python，Go等）更佳7、思路清晰，具备良好的编程能力，较强的分析和解决问题的能力； 8、良好的交流沟通能力和团队合作精神；,拓新思维，创造未来。拓维信息系统股份有限公司成立于1996年，成立之初，就立志做一家不断创新的科技企业。2008年，公司登陆深圳证券交易所，成功上市。历经多年发展，拓维信息现已成为拥有3000多名员工，以教育科技、软件服务、移动游戏为主营业务，在北京、上海、深圳、山东、香港、美国、日本等地设立了分支,东莞市 东莞市 光大We谷B区 401
Java,15-20K,招聘会js，java，python 任何一种语言的开发工程师,华为技术有限公司华为技术有限公司是一家生产销售通信设备的民营通信科技公司，于1987年正式注册成立，总部位于中国广东省深圳市龙岗区坂田华为基地。[1]华为是全球领先的信息与通信技术（ICT）解决方案供应商，专注于ICT领域，坚持稳健经营、持续创新、开放合作，在电信运营商、企业、终端和云计算等领域构,东莞华为溪流背坡村K区
高级软件工程师,18-26K,1、熟悉Java、Python、Js中至少一种语言，熟悉WEB开发框架，掌握常见的数据结构、算法，掌握软件工程、敏捷开发流程等知识，熟悉常用设计模式。2、熟悉大数据、分布式组件技术，熟悉消息组件等技术者优先，包括Hadoop、ZK、Spark、Hbase、Storm、Kafka、K8S、ES等3、熟悉微服务、虚拟化等理念和技术，并有一定项目实践者优先。,华为技术有限公司成立于1987年，总部位于中国广东省深圳市龙岗区。华为是全球领先的信息与通信技术（ICT）解决方案供应商，专注于ICT领域，坚持稳健经营、持续创新、开放合作，在电信运营商、企业、终端和云计算等领域构筑了端到端的解决方案优势，为运营商客户、企业客户和消费者提供有竞争力的ICT解决方案、,东莞东莞市溪流背坡村(华为)
python开发,15-25K,岗位职责：1、根据开发计划，设计软件模块，完成软件模块源代码编写，实现开发需求规定的功能；2、根据开发需求，完成开发文档，提出模块设计的规划；3、根据开发文档，制定详细的开发计划；4、按要求完成其他相关工作。任职资格：1.计算机相关专业；2.熟悉python语言web开发，二年以上开发经验；3.熟悉django/tornado/Flask等python框架，有大开发项目经验优先；4.熟悉mysql数据库开发与优化，对数据库有较强的设计能力；5.熟悉nginx的配置优化者优先6.良好的编码习惯，有强烈的责任心及良好的团队合作精神,上海易宝软件有限公司是一家全球领先的软件和IT外包供应商，专长于软件开发、信息技术和个性化、专业化服务。　　上海易宝软件有限公司是由香港上市企业易宝系统（HKSE：8086）全资控股的专业从事软件和IT外包服务的企业，十几年来，我们的客户遍布欧美、日本、新加坡、香港、中国等国家和地区，为客户提供,东莞东莞市光大We谷
Python开发工程师,12-24K,"1、全日制统招本科，学信网可查。3年及3年以上python项目开发经验；2、熟悉tornado,或flask、django框架，并深入了解其中一种；3、熟悉至少一种数据库（mysql、oracle）、至少掌握一种Nosql数据库（MongoDB、redis、HBase、Couchbase、Neo4j、Cassandra）；4、熟悉常用的web容器相关技术，熟悉uwsgi、nginx、web服务器；5、熟悉restful api设计风格和规则；6、良好的面向对象分析设计和编程能力，熟悉设计模式；7、熟悉云计算理论、CAP理论、微服务",武汉佰钧成技术有限责任公司（以下简称“佰钧成”）致力成为中国领先的数字技术服务提供商，总部位于中国科教之城武汉（光谷软件园）。自2006年成立以来，佰钧成秉承“创造价值 承诺必达”的服务宗旨，迅速成长为IBM、华为、Google、Micros,东莞光大We谷
python研发工程师实习生,6-9K,岗位要求：1. 负责颉一数据产品设计和实现，保证效率和质量2. 负责模块开发和单元测试3. 编写软件工具挖掘大型结构化和非结构化数据4. 使用微服务架构实现可扩展的数据接入和敏捷虚拟化任职要求：1. 计算机或相关专业学历，精通 Python 或 Java 语言2. 熟悉Linux系统编程，理解云计算架构3. 了解数据库原理和数据备份技术4. 具备良好的沟通能力和团队合作精神5. 工作积极主动，学习能力强,D-Uni 公司（中文：颉一软件）由硅谷归国专家团队创建，持续 15 年的企业数据管理和云化领域的技术沉淀、首创性的提出了“数据库虚拟化”、“数据虚拟化”、“数据管理敏捷层”等创新性理念，定义和开创了新的产品品类，全面领先业界,广州市 天河区 大观中路 科汇园
Python,5-10K·13薪,绩效考核,python框架：1、设计爬虫策略和防屏蔽规则，提升网页的抓取效率和质量2、能熟练使用python主流框架：django、flask、Celery等3、熟悉网页抓取原理及技术，熟悉基于Cookie的网站登录原理，熟悉基于正则表达式、Xpath、CSS等网页信息抽取技术；4、熟悉大规模系统的负载均衡、缓存、网络存储、网络安全、数据库高可用设计及性能评估机制；5、熟悉分布式系统的设计和应用，熟悉分布式、缓存、消息等机制；6、有RPA项目实施经验优先，对IE、chrome、firefox浏览器有深入研究优先7、良好的沟通能力,广州海珠区保利国际广场北塔楼
Python服务开发,3-5K,创业团队-自由职业招聘Python服务端开发熟悉python web各主流框架 Django Flask等熟悉微信公众号或者小程序开发熟悉部署相关 Linux等熟悉项目开发相关 Git 了解前端相关 Vue,软件开发;信息系统集成服务;信息技术咨询服务;网络技术的研究、开发;计算机技术开发、技术服务;通信技术研究开发、技术服务;电子防伪系统技术开发、技术服务;计算机信息安全产品设计;软件服务;企业形象策划服务;策划创意服务;市场营销策划服务;大型活动组织策划服务(大型活动指晚会、运动会、庆典、艺术和模特,广州天河区暨南大学华文学院-行政综合楼
服务器开发工程师（python）,12-18K,位职责：1、基于各产品线业务需求，负责高并发、大规模数据服务的架构设计、系统开发； 2、构建大数据服务相关基础设施，实现与数据仓库的高效交互；岗位要求：1、全日制统招本科及以上，计算机相关专业，且有3年以上相关工作经验，优秀者可放宽要求； 2、熟悉 Python 主流服务端开发框架如 Django、Tornado、Flask 等，并理解其实现原理; 3、有推荐系统、大规模数据集 API 开发经验，熟悉其他服务端开发语言，如 Go、Java 等； 4、了解数据仓库知识，对大数据体系及相关技术有较为全面的认识； 5、逻辑清晰、沟通能力好。,广州艾美网络科技有限公司（以下简称“艾美科技”）是一家专注于移动互联网音乐发展与设备研发的创新科技公司。一直聚焦于网络音乐服务终端、音乐娱乐设备、网络音乐HIFI产品等多个业务领域的深耕发展。自2013年开始，艾美科技主动转型升级，谋求突破发展。通过研,广州番禺区和业投资大厦和业投资大厦3A层
Python,10-15K,"python后台 1. 有较好的Python编程基础，2. 具有Django 框架开发经验,3. 有一定的数据结构基础4. 熟练使用 git 进行代码管理及团队协作开发5.熟悉python多线程6. 熟悉掌握javascript,css3,html5 熟练使用前端自动化构建工具，熟悉webpack,对前端工程化和模块化开发有一定的了解7.熟悉vue框架，有vue项目经验。8. 了解HTTP协议，了解TCP/IP的基本工作原理 了解前端开发安全知识，能对页面做基本的性能优化9.熟练使用熟悉redis、熟悉Mysql。",广州够力网络科技有限公司成立于2017年，长期致力于为客户提供软件外包、软件定制开发、系统维护、OA办公系统、手机软件定制等等，公司管理人性化，拥有完善的职业晋升路径，希望有志于长期从事软件开发及互联网周边的人才加入共同发展。,广州天河区时代TIT广场2栋402
python架构师,20-25K,【工作职责】1.参与公司研发技术规划，执行核心产品的运营技术分析和技术架构设计及应用开发工作；2.协助解决项目开发过程中的技术难题，推动自动化测试和标准化部署方案，核心技术攻关和系统优化工作；3.参与互联网医院平台、远程医疗平台或区域卫生平台的运营分析和功能架构设计;4.保持和产品经理、项目经理紧密配合，相互协作完成项目开发、管理技术组件积累及规范；5.需要面向客户，提供对外技术支持，执行项目技术方案编写；6.配合项目的整体计划，对技术人员进行技术培训和指导，加速团队的成长；7.跟踪、研究医疗互联网业界相关前沿技术，对相关项目提供技术支撑；【任职资格】1.统招本科及以上学历，计算机科学、信息科学、统计学、应用数学等相关专业，3年以上开发\设计\架构经验；2.掌握MySQL、SQL Server、Oracle、Redis其中至少两种以上数据库开发技术；3.熟悉大规模系统的负载均衡、缓存、网络安全、数据库可用设计及性能评估机制；4.熟悉Spring、 Django、Mybatis等主流框架，了解Hadoop、ZooKeeper、Spark、Kafka等分布式架构和系统；5.有医疗信息化产品开发经验，了解医院HIS、LIS系统业务需求;6.熟悉常用性能调优方法，掌握线程、Socket、EJB、RMI、数据结构、多态等应用技术；7.精通常用软件设计模式、设计方法，熟悉OOA、OOD，具备复杂软件架构设计能力；8.熟悉医疗行业信息化智能化解决方案、具有在高性能、高可用性和可扩展性的分布式Web（或云）服务方面经验者优先;具备良好的沟通表达能力、抗压能力和团队合作精神；具备优秀的文档能力，使用文字、图示及相关工具清楚地表达架构意图，能够熟练编写各类技术文档。,广东珠江智联信息科技股份有限公司（下称 “珠江智联”）是广州珠江数码集团股份有限公司（下称“珠江数码”）控股的科技类子公司。     珠江智联依托集团公司二十余年的强大研发能力及客户服务体系，并结合自身专业的服务团队及资深技术型销售,广州市 海珠区 广州国际采购中心 1413
Python,7-12K,"1.至少1年以上Python开发经验，精通Python服务端编程，精通网络编程2.使用Python开发过大型系统经验者优先；3.熟悉Django/Flask等web开发框架；4.熟练使用mysql，熟悉 Redis/MongoDB/Celery；5.精通Mysql数据库的配置和优化技术，熟悉各种WEB缓存技术，并有实际的项目经验,熟悉分布式数据存储，以及高流量访问、大用户量级平台的后台系统设计与开发6.对于目前主流数据工具Hadoop/Hive/Spark等工具有一定的了解；7.熟悉Windows/linux服务器操作系统和PC操作系统，有云服务器搭建和基本的虚拟服务器技术，有服务器集群搭建经验优先",,广州越秀区富力·东山新天地(正门)1906
Python WEB工程师,4-9K,岗位要求： 1、负责内部系统、自动化系统、商城等服务端/Web端系统的开发和维护；2、熟悉Python编程，了解Flask/Django/Tornado等后台框架；3、熟悉运用Linux操作系统，了解HTTP、TCP/IP、网络编程，了解进程、线程等概念，能独立解决简单常见的问题；4、有整站开发经验者优先，熟悉微信/小程序开发者优先；5、掌握C/C++/PHP/Ruby/Go等其他编程语言的优先；工作环境：1. 我们是一个以技术为主的团队，技术氛围活泼；2. 团队大部分都是90后，轻松好玩；3. 办公室处于广州珠江新城地铁口，交通方便；4. 上班时间人性化，不强制考勤；5. 常备下午茶和各种零食，不定期团建活动；,广东优德科技是一家领先的场景化智能技术方案供应商，专注于互联网与移动互联网的场景化的研究与开发，在电子商务、行业平台、App开发、微信、图像识别、数据分析、CDN等领域有广泛的应用和服务。我们团队以技术为主，核心成员有多年的开发和运维经验，具有雄厚的技术开发实力；小伙伴基本都是90后，技术活泼，,广州市 海珠区 中山大学国家大学科技园A座 1303
初级Python后端开发工程师,8-12K,我们是一个从微信出来的创业团队，希望找到志同道合的小伙伴加入我们。----岗位职责：1. 负责后台服务架构设计和开发；2. 参与设计系统技术方案，核心代码开发和系统调优；3. 参与各专项技术调研，新技术引入等前瞻项目。岗位要求：1. 半年或以上后台开发经验，本科及以上学历，计算机相关专业；2. 热爱计算机科学和互联网技术，精通Python语言，熟悉C.C++.Go.Java中的一种或多种语言；3. 有优秀的逻辑分析能力，能够对业务逻辑进行合理的抽象和拆分；4. 有强烈的求知欲，优秀的学习和沟通能力。,我们是一群来自微信的小伙伴，专注在社交领域打磨产品。关注我们的公众号可以深入了解我们。,广州海珠区广州国际采购中心
python web前端,4-8K,工作职责：1.负责Python web全栈开发，同时负责前端和后台开发2.利用多种技能独立完成web应用软件开发任职资格：1.本科以上学历，计算机、软件工程、自动化等相关专业毕业；2.具备Python开发经验1年以上；3.熟悉Python语言，至少熟悉一种框架，如Flask、Django等；4.熟悉前端的基本调试工具，并熟练掌握HTML5、CSS3、jQuery、Ajax等Web前端技术；5.熟悉前端开发的开源工具包Bootstrap，有响应式页面开发经验者优先；6.熟悉MariaDB（MySQL）、Oracle或其他任何一种关系型数据库管理系统（RDBMS）；7.了解MongoDB；8.具有良好的代码习惯，结构清晰，命名规范，逻辑性强；9.思路清晰开阔，能够独立分析解决问题;10.学习能力强，技术视野广阔，乐于不断学习新知识；11.有良好的团队精神和与客户的沟通能力；12.具有并行计算编程能力者优先。,,广州海珠区凤凰创意园3号楼
数据可视化工程师,18-35K,"岗位职责：1. 研究异构数据源整合技术，打破数据孤岛；实时的数据展现，方便了解业务情况，及时做出决策；2. 研究多种展示模块和风格，根据业务需求看灵活实现自主定制；3. 研究各种可视化组建，包括2D、3D 及动态展示组件，配合分析部门，实现数据展示、数据分析有效融合。任职资格：1.研究生或重点院校（211/985）本科及以上学历；数学，统计学、计算机、信息、自动化等相关专业，具备良好的英语阅读能力；2.有较强的逻辑思维能力和动手能力，数据可视化技术熟悉，了解常见的数据可视化技术；3.熟练掌握C/C++,JAVA,Python中的一种或多种语言，熟悉Linux/Unix开发环境，熟悉Shell语言；4.熟练使用数据可视化工具，如：Echarts，D3，Power BI等；5.熟悉hadoop/hive/spark/ES/druid /openstack等平台者优先；6.具备良好的沟通、表达与协调能力，具备良好的团队合作意识，较强的责任感及进取精神；7.有强烈的持续自我学习能力和意愿，善于学习新的知识，乐于发现、分析和解决复杂问题。",工作地点：大湾区核心城市佛山（公司总部距离广州南站15分钟车程）广东博智林机器人有限公司作为碧桂园集团的全资子公司，成立于2018年7月，是以机器人本体及核心技术研发生产为业务内容的科技型公司。博智林机器人依托世界500强碧桂园集团的平台，将通过自身资金、团队优势以及整合研究能力，选址位于粤,东莞市 东莞市 碧桂园
运维工程师,12-24K,岗位职责：1、负责线上业务服务器环境规划和搭建；2、负责线上业务的定期巡检，以及线上告警、用户反馈的跟进，拉通资源处理；3、负责自动化工具、平台的迭代开发优化，以满足业务需求；岗位要求：1.计算机相关专业毕业，本科及以上学历；2.至少2年以上互联网行业运维经验；3.精通linux系统，能熟练使用脚本语言Python/Shell进行编程工作;4.精通nginx、tomcat、mysql、redis等中间件的使用及维护；5.精通zabbix、ELK、jenkins等工具的使用及维护；6.熟悉主流品牌服务器软硬件运维；7.有一定的网络基础知识，能完成一些基本的网络运维；8.具备很强的沟通协调能力和团队协作能力；,步步高成立于1995年，是一家深耕教育行业逾二十年的高科技公司。先后推出了步步高复读机、电子词典、点读机“哪里不会点哪里 so easy! ”等众多经典产品，我们带着满满的爱和责任，将心注入，用产品见证和陪伴一代又一代中国孩子成长。当前，公司旗下拥有“步步,东莞市 东莞市 小天才科技有限公司研发中心
OS适配工程师,11-20K,1、全日制本科学历2、具备3年以上软件测试经验或手机APP测试经验，能独立承担或主导复杂软件的功能测试和性能测试，能熟练使用python写测试脚本3、能熟练掌握各种软件测试方法，有较强的品质意识4、具有良好的沟通能力和逻辑思维能力，能够承受一定的工作压力1、负责手机系统APP的测试和品质管理工作2、参与需求分析、设计评审，制定全面的测试方案3、设计测试用例并执行测试和编写测试报告4、测试质量分析与测试方法改进5、评估自动化实现范围，参与自动化落地建设,佰钧成公司拥有5000多名员工，是华中地区规模最大的IT服务外包供应商，总部位于中国的科教之城武汉，在北京、深圳、上海、南京等全国20多个城市都设有分公司和办事处。主要业务是面向欧美、日本以及国内市场的制造业、金融、电信、电力、及IT行业提供ITO、BPO服务，是华为、IBM、Google、Alca,东莞市 东莞市 OPPO工业园(5号门)
软件开发工程师,15-25K,"工作职责：1.负责产线所有测试软件的开发；2.测试算法调试及优化；3.根据需求部门做软件相应功能的升级及优化；4.设计完整的测试开发系统；5.参与项目测试方案的评审；6.负责编制、整理相关文档和资料；7.负责测试软件的使用培训；任职要求1.大专及以上，计算机，光学，声学或自动化专业；2.熟悉软件界面、数据处理、端口协议（如GPIB，PCI，PXI，USB，RS232等）；3.熟练掌握C#/C++,VS或LabVIEW，Python，OpenCV，Halcon等语言；4.3年以上测试系统开发经验，熟悉音频测试原理，电路原理，有音箱，耳机等音频产品自动化测试软件开发经验优先；5.熟悉视觉测试原理，及测试算法开发，有LENS，Camera，LCD等测试软件开发经验优先；6.具备一定的英文能力，能通读英文文献，能用英语进行简单的沟通交流；",歌尔股份有限公司成立于2001年6月，2008年5月在深交所上市，主要从事微型声学模组、传感器、微显示光机模组等精密零组件，虚拟现实/增强现实、智能穿戴、智能音响、机器人/无人机等智能硬件的研发、制造和销售，目前已在多个领域建立了全球领先的综合竞争力。自上市以来，歌尔保持高速成长，年复合增长率达44,东莞市 东莞市 歌尔智能科技有限公司
